{
  "$schema": "https://alice51849.github.io/ios-app-guide/api/v1/bopomofo-symbols/symbol.schema.json",
  "apiVersion": "1.0.0",
  "datasetVersion": "1.0.0",
  "license": "https://creativecommons.org/licenses/by/4.0/",
  "symbol": {
    "order": 24,
    "symbol_id": "u3129",
    "concept_uri": "https://alice51849.github.io/ios-app-guide/data/zhuyin-bopomofo-vocabulary.html#u3129",
    "symbol": "ㄩ",
    "unicode": "U+3129",
    "pinyin": "ü / yu",
    "ipa": "y",
    "category": "medial",
    "category_uri": "https://alice51849.github.io/ios-app-guide/data/zhuyin-bopomofo-vocabulary.html#medials",
    "example_character": "魚",
    "example_pinyin": "yú",
    "example_meaning_en": "fish"
  },
  "provenance": {
    "concept": "https://alice51849.github.io/ios-app-guide/data/zhuyin-bopomofo-vocabulary.html#u3129",
    "dataset": "https://alice51849.github.io/ios-app-guide/data/zhuyin-bopomofo-ml-dataset.croissant.jsonld",
    "vocabulary": "https://alice51849.github.io/ios-app-guide/data/zhuyin-bopomofo-vocabulary.jsonld"
  }
}
